{
  "generated_at": "2026-10-14T01:52:13.857Z",
  "status": "live",
  "method": "Each refresh records the Oracle's decisive forecasts (peaking / accelerating / rising / fading) in data/forecast_ledger.json. 48h later the forecast is compared with the actual velocity history and scored hit/miss; when the 48h window holds fewer than 2 actual snapshots the call is marked unverifiable (data gap — not a miss) with its reason recorded. Nothing is backfilled — the log starts 2026-10-11, so the first resolutions land 48h after that.",
  "horizon_hours": 48,
  "resolution_rules": {
    "rising_accelerating": "hit if the actual velocity slope over the 48h window after the forecast is >= +1.5/hr (the classifier's own rising threshold)",
    "peaking": "hit if the highest velocity in the 48h window stays at/below the forecast-time velocity +2 (the top was called, not blown through)",
    "fading": "hit if the actual velocity slope over the 48h window is <= -1.5/hr (the classifier's own falling threshold)",
    "unverifiable": "the 48h window holds fewer than 2 actual velocity snapshots (data gap: topic dropped, series pruned, fetch outage) — counted separately, never folded into the hit rate"
  },
  "counts": {
    "recorded": 315,
    "pending": 172,
    "resolved": 134,
    "unverifiable": 9,
    "hits": 14
  },
  "upcoming_resolutions": [
    {
      "date": "2026-10-14",
      "pending": 143
    },
    {
      "date": "2026-10-15",
      "pending": 29
    }
  ],
  "next_resolution_at": "2026-10-14T02:11:34.070Z",
  "resolution_readiness": {
    "pending": 172,
    "with_sufficient_data": 140,
    "awaiting_data": 32
  },
  "recorded_per_day": [
    {
      "date": "2026-10-12",
      "recorded": 286
    },
    {
      "date": "2026-10-13",
      "recorded": 29
    }
  ],
  "by_confidence": {
    "high": {
      "resolved": 0,
      "hits": 0
    },
    "medium": {
      "resolved": 0,
      "hits": 0
    },
    "low": {
      "resolved": 0,
      "hits": 0
    }
  },
  "hit_rate": 0.104,
  "hit_rate_note": "Hit rate across 134 decisive resolved forecasts (9 unverifiable excluded).",
  "by_state": {
    "peaking": {
      "resolved": 15,
      "hits": 14
    },
    "accelerating": {
      "resolved": 1,
      "hits": 0
    },
    "rising": {
      "resolved": 0,
      "hits": 0
    },
    "fading": {
      "resolved": 118,
      "hits": 0
    }
  },
  "recent": [
    {
      "topic_id": "six-seven-meme",
      "title": "\"6-7\" — Gen Alpha's defining brainrot joke",
      "forecast_at": "2026-10-12T01:45:28.760Z",
      "topic_live": true,
      "state": "peaking",
      "peak_in_hours": 0,
      "verdict": "hit",
      "reason": "max velocity in window 92 vs forecast-time 92 (tolerance +2)",
      "actual_slope": 0,
      "actual_end_velocity": 92,
      "actual_max_velocity": 92,
      "n_actual_points": 18,
      "actual_first_ts": "2026-10-12T02:46:54.868540+00:00",
      "actual_last_ts": "2026-10-13T10:15:52.754276+00:00",
      "window_coverage_hours": 31.5,
      "n_snapshots": 3
    },
    {
      "topic_id": "seis-sete-dance",
      "title": "\"Six Seven\" (Seis Sete) funk dance",
      "forecast_at": "2026-10-12T01:45:28.760Z",
      "topic_live": true,
      "state": "peaking",
      "peak_in_hours": 0,
      "verdict": "hit",
      "reason": "max velocity in window 90 vs forecast-time 90 (tolerance +2)",
      "actual_slope": 0,
      "actual_end_velocity": 90,
      "actual_max_velocity": 90,
      "n_actual_points": 18,
      "actual_first_ts": "2026-10-12T02:46:54.868540+00:00",
      "actual_last_ts": "2026-10-13T10:15:52.754276+00:00",
      "window_coverage_hours": 31.5,
      "n_snapshots": 3
    },
    {
      "topic_id": "trump-rally-nobel",
      "title": "Trump roasts rally protester; Nobel Prize outrage",
      "forecast_at": "2026-10-12T01:45:28.760Z",
      "topic_live": true,
      "state": "peaking",
      "peak_in_hours": 0,
      "verdict": "hit",
      "reason": "max velocity in window 90 vs forecast-time 90 (tolerance +2)",
      "actual_slope": 0,
      "actual_end_velocity": 90,
      "actual_max_velocity": 90,
      "n_actual_points": 18,
      "actual_first_ts": "2026-10-12T02:46:54.868540+00:00",
      "actual_last_ts": "2026-10-13T10:15:52.754276+00:00",
      "window_coverage_hours": 31.5,
      "n_snapshots": 3
    },
    {
      "topic_id": "nba-tiktok-surge",
      "title": "#nba explodes on TikTok (+493%)",
      "forecast_at": "2026-10-12T01:45:28.760Z",
      "topic_live": true,
      "state": "peaking",
      "peak_in_hours": 0,
      "verdict": "hit",
      "reason": "max velocity in window 86 vs forecast-time 86 (tolerance +2)",
      "actual_slope": 0,
      "actual_end_velocity": 86,
      "actual_max_velocity": 86,
      "n_actual_points": 18,
      "actual_first_ts": "2026-10-12T02:46:54.868540+00:00",
      "actual_last_ts": "2026-10-13T10:15:52.754276+00:00",
      "window_coverage_hours": 31.5,
      "n_snapshots": 3
    },
    {
      "topic_id": "nana-patekar-tributes",
      "title": "Nana Patekar dies at 75 — meme legend tributes",
      "forecast_at": "2026-10-12T01:45:28.760Z",
      "topic_live": true,
      "state": "peaking",
      "peak_in_hours": 0,
      "verdict": "hit",
      "reason": "max velocity in window 85 vs forecast-time 85 (tolerance +2)",
      "actual_slope": 0,
      "actual_end_velocity": 85,
      "actual_max_velocity": 85,
      "n_actual_points": 18,
      "actual_first_ts": "2026-10-12T02:46:54.868540+00:00",
      "actual_last_ts": "2026-10-13T10:15:52.754276+00:00",
      "window_coverage_hours": 31.5,
      "n_snapshots": 3
    },
    {
      "topic_id": "patient-zero-swift",
      "title": "Taylor Swift \"Patient Zero\" wedding edits",
      "forecast_at": "2026-10-12T01:45:28.760Z",
      "topic_live": true,
      "state": "peaking",
      "peak_in_hours": 0.7,
      "verdict": "hit",
      "reason": "max velocity in window 84 vs forecast-time 84 (tolerance +2)",
      "actual_slope": 0,
      "actual_end_velocity": 84,
      "actual_max_velocity": 84,
      "n_actual_points": 18,
      "actual_first_ts": "2026-10-12T02:46:54.868540+00:00",
      "actual_last_ts": "2026-10-13T10:15:52.754276+00:00",
      "window_coverage_hours": 31.5,
      "n_snapshots": 3
    },
    {
      "topic_id": "pumpkin-head",
      "title": "Pumpkin Head Illusion",
      "forecast_at": "2026-10-12T01:45:28.760Z",
      "topic_live": true,
      "state": "peaking",
      "peak_in_hours": 0.7,
      "verdict": "hit",
      "reason": "max velocity in window 78 vs forecast-time 78 (tolerance +2)",
      "actual_slope": 0,
      "actual_end_velocity": 78,
      "actual_max_velocity": 78,
      "n_actual_points": 18,
      "actual_first_ts": "2026-10-12T02:46:54.868540+00:00",
      "actual_last_ts": "2026-10-13T10:15:52.754276+00:00",
      "window_coverage_hours": 31.5,
      "n_snapshots": 3
    },
    {
      "topic_id": "october-music-drops",
      "title": "October's stacked release calendar",
      "forecast_at": "2026-10-12T01:45:28.760Z",
      "topic_live": true,
      "state": "peaking",
      "peak_in_hours": 0,
      "verdict": "hit",
      "reason": "max velocity in window 71 vs forecast-time 71 (tolerance +2)",
      "actual_slope": 0,
      "actual_end_velocity": 71,
      "actual_max_velocity": 71,
      "n_actual_points": 18,
      "actual_first_ts": "2026-10-12T02:46:54.868540+00:00",
      "actual_last_ts": "2026-10-13T10:15:52.754276+00:00",
      "window_coverage_hours": 31.5,
      "n_snapshots": 3
    },
    {
      "topic_id": "emily-thats-all",
      "title": "\"And Emily… that's all\" audio",
      "forecast_at": "2026-10-12T01:45:28.760Z",
      "topic_live": true,
      "state": "peaking",
      "peak_in_hours": 0,
      "verdict": "hit",
      "reason": "max velocity in window 70 vs forecast-time 70 (tolerance +2)",
      "actual_slope": 0,
      "actual_end_velocity": 70,
      "actual_max_velocity": 70,
      "n_actual_points": 18,
      "actual_first_ts": "2026-10-12T02:46:54.868540+00:00",
      "actual_last_ts": "2026-10-13T10:15:52.754276+00:00",
      "window_coverage_hours": 31.5,
      "n_snapshots": 3
    },
    {
      "topic_id": "spooky-season",
      "title": "#spookyseason peaks — Halloween is a Saturday",
      "forecast_at": "2026-10-12T01:45:28.760Z",
      "topic_live": true,
      "state": "peaking",
      "peak_in_hours": 0,
      "verdict": "hit",
      "reason": "max velocity in window 93 vs forecast-time 93 (tolerance +2)",
      "actual_slope": 0,
      "actual_end_velocity": 93,
      "actual_max_velocity": 93,
      "n_actual_points": 18,
      "actual_first_ts": "2026-10-12T02:46:54.868540+00:00",
      "actual_last_ts": "2026-10-13T10:15:52.754276+00:00",
      "window_coverage_hours": 31.5,
      "n_snapshots": 3
    },
    {
      "topic_id": "battlefield-6-gamepass",
      "title": "Battlefield 6 hits Game Pass day one",
      "forecast_at": "2026-10-12T01:45:28.760Z",
      "topic_live": true,
      "state": "peaking",
      "peak_in_hours": 0,
      "verdict": "hit",
      "reason": "max velocity in window 87 vs forecast-time 87 (tolerance +2)",
      "actual_slope": 0,
      "actual_end_velocity": 87,
      "actual_max_velocity": 87,
      "n_actual_points": 18,
      "actual_first_ts": "2026-10-12T02:46:54.868540+00:00",
      "actual_last_ts": "2026-10-13T10:15:52.754276+00:00",
      "window_coverage_hours": 31.5,
      "n_snapshots": 3
    },
    {
      "topic_id": "ramalama-walk",
      "title": "Ramalama Costume Walk",
      "forecast_at": "2026-10-12T01:45:28.760Z",
      "topic_live": true,
      "state": "peaking",
      "peak_in_hours": 0.7,
      "verdict": "hit",
      "reason": "max velocity in window 90 vs forecast-time 90 (tolerance +2)",
      "actual_slope": 0,
      "actual_end_velocity": 90,
      "actual_max_velocity": 90,
      "n_actual_points": 18,
      "actual_first_ts": "2026-10-12T02:46:54.868540+00:00",
      "actual_last_ts": "2026-10-13T10:15:52.754276+00:00",